{
  "schema_version": "distributed_agents-corpus-release-v1",
  "release_id": "shi_holdout",
  "title": "Shi holdout corpus",
  "corpus_family": "shi_holdout",
  "release_date": "2026-09-01",
  "description": "A 1,773-target holdout corpus with structured ledgers, Claims, comparator relationships, and a queryable BioKG projection.",
  "artifacts": {
    "reports": {
      "path": "artifacts/reports/reports.jsonl",
      "kind": "per_target_reports",
      "format": "jsonl",
      "media_type": "application/x-ndjson",
      "sha256": "0d4e926be8a066952c0e1857b9fab5ec70396093b4f8bb41de1a5dc7768a487f",
      "bytes": 78009059,
      "records": 1773,
      "schema": "schemas/report.schema.json",
      "required_fields": ["dataset_variant", "gene_target", "report", "run_id", "sampled_at_utc"],
      "text_field": "report",
      "target_field": "gene_target"
    },
    "evidence": {
      "path": "artifacts/ledgers/evidence.jsonl",
      "kind": "evidence_ledger",
      "format": "jsonl",
      "media_type": "application/x-ndjson",
      "sha256": "cb471eb1fc2f98c75c78006e319877f02d01cb877341bc4e77008a86c66f39d6",
      "bytes": 31418604,
      "records": 45640,
      "schema": "schemas/evidence.schema.json",
      "required_fields": ["doc_id", "target_gene", "evidence_id", "source_line", "source_report_sha256"],
      "id_column": "evidence_id",
      "scope_column": "target_gene"
    },
    "references": {
      "path": "artifacts/ledgers/references.jsonl",
      "kind": "references_ledger",
      "format": "jsonl",
      "media_type": "application/x-ndjson",
      "sha256": "ca383015fc09a8e1fd55ab1e576a1950cc025814be32f0d85ecc8237d8e49e2e",
      "bytes": 11060798,
      "records": 13974,
      "schema": "schemas/reference.schema.json",
      "required_fields": ["doc_id", "target_gene", "ref_id", "source_line", "source_report_sha256"],
      "id_column": "ref_id",
      "scope_column": "target_gene"
    },
    "mgi_target_mapping": {
      "path": "artifacts/contracts/mgi_target_mapping.json",
      "kind": "target_normalization_ledger",
      "format": "json",
      "media_type": "application/json",
      "sha256": "c27be89d0f021d2c610e15f88971b6696b12564443a6d526e26f95e22b8ec45b",
      "bytes": 778328,
      "records": 1,
      "schema": "schemas/mgi-target-mapping.schema.json",
      "required_fields": ["schema_version", "source", "mappings", "summary"]
    },
    "publication_reference_mapping": {
      "path": "artifacts/contracts/publication_reference_mapping.json",
      "kind": "publication_reference_normalization_ledger",
      "format": "json",
      "media_type": "application/json",
      "sha256": "9f0b2bc1fc1eb92c78f89c00123b6de3b1dd868c6ba7e3c933a83d58c486c7eb",
      "bytes": 9111799,
      "records": 1,
      "schema": "schemas/publication-reference-mapping.schema.json",
      "required_fields": ["schema_version", "release_id", "source", "policy", "mappings", "summary"]
    },
    "findings": {
      "path": "artifacts/ledgers/findings.jsonl",
      "kind": "biological_findings_ledger",
      "format": "jsonl",
      "media_type": "application/x-ndjson",
      "sha256": "b1f9dc74ceb3a95cf41b14977abbc82c2d110303eca701b90ab2ae5da251acef",
      "bytes": 13774975,
      "records": 8718,
      "schema": "schemas/finding.schema.json",
      "required_fields": ["doc_id", "target_gene", "finding_id", "finding_type", "summary", "evidence_ids", "ref_ids"],
      "id_column": "finding_id",
      "scope_column": "target_gene"
    },
    "null_findings": {
      "path": "artifacts/ledgers/null_findings.jsonl",
      "kind": "null_cause_findings_ledger",
      "format": "jsonl",
      "media_type": "application/x-ndjson",
      "sha256": "52190dae8c122eb9ac4607920b886617eb8a3b25ea86ea2cec73eddf31ecbea0",
      "bytes": 6364948,
      "records": 3079,
      "schema": "schemas/null-finding.schema.json",
      "required_fields": ["doc_id", "target_gene", "finding_id", "finding_type", "summary", "null_cause", "evidence_ids", "ref_ids"],
      "id_column": "finding_id",
      "scope_column": "target_gene"
    },
    "pathways": {
      "path": "artifacts/ledgers/pathways.jsonl",
      "kind": "pathway_summary_ledger",
      "format": "jsonl",
      "media_type": "application/x-ndjson",
      "sha256": "99e85d5591a7abcbd27da5a656ecc61502a418bf903a84da494804c748c66021",
      "bytes": 4838813,
      "records": 6729,
      "schema": "schemas/pathway.schema.json",
      "required_fields": ["doc_id", "target_gene", "pathway_id", "pathway", "evidence_ids", "finding_ids"],
      "id_column": "pathway_id",
      "scope_column": "target_gene"
    },
    "cell_types": {
      "path": "artifacts/ledgers/cell_types.jsonl",
      "kind": "cell_type_summary_ledger",
      "format": "jsonl",
      "media_type": "application/x-ndjson",
      "sha256": "b2ae2cf8ab43c97e3cddc01d98c0d740ee645a52feb149f7bc8553f4ecc362d6",
      "bytes": 17007859,
      "records": 29380,
      "schema": "schemas/cell-type.schema.json",
      "required_fields": ["doc_id", "target_gene", "cell_type_id", "cell_type", "summary", "evidence_ids", "finding_ids", "ref_ids"],
      "id_column": "cell_type_id",
      "scope_column": "target_gene"
    },
    "extraction_audit": {
      "path": "artifacts/audits/extraction.json",
      "kind": "extraction_audit",
      "format": "json",
      "media_type": "application/json",
      "sha256": "72ae9491249eacc1ff3943e1b04b7682673d686b97691b6f14f9d6fe6d9a51a5",
      "bytes": 3309,
      "records": 1,
      "schema": "schemas/extraction-audit.schema.json",
      "required_fields": ["schema_version", "source", "ledger_records", "repairs_applied", "issues", "build_policy"]
    },
    "claim_neighborhoods": {
      "path": "artifacts/claims/neighborhoods.jsonl",
      "kind": "claim_construction_neighborhoods",
      "format": "jsonl",
      "media_type": "application/x-ndjson",
      "sha256": "0260c6f57aa24ca2e4c9c5c32109d5102abb70b3632268db339718bf872b7b2c",
      "bytes": 510923,
      "records": 1381,
      "schema": "schemas/claim-neighborhood.schema.json",
      "required_fields": ["schema_version", "construction_scope", "neighborhood_id", "finding_doc_ids", "seed_pair_ids", "retrieval_lanes", "contains_one_sided_seed"],
      "id_column": "neighborhood_id",
      "scope_column": "construction_scope"
    },
    "claim_proposals": {
      "path": "artifacts/claims/proposals.jsonl",
      "kind": "claim_induction_proposals",
      "format": "jsonl",
      "media_type": "application/x-ndjson",
      "sha256": "5adbdf82a427734e6cb13d33d71c6c7fde38c108d1c1ce1a089614c6982b2a81",
      "bytes": 2771996,
      "records": 1629,
      "schema": "schemas/claim-proposal.schema.json",
      "required_fields": ["schema_version", "construction_scope", "proposal_id", "source_neighborhood_id", "statement", "scope", "confidence", "contributions"],
      "id_column": "proposal_id",
      "scope_column": "construction_scope"
    },
    "claim_proposal_dispositions": {
      "path": "artifacts/claims/proposal_dispositions.jsonl",
      "kind": "claim_consolidation_proposal_dispositions",
      "format": "jsonl",
      "media_type": "application/x-ndjson",
      "sha256": "83c8943c55ab5d58db3e0c702d62bf1d408564b1b959cdc0f97c2815b7c20e9a",
      "bytes": 629043,
      "records": 1629,
      "schema": "schemas/claim-proposal-disposition.schema.json",
      "required_fields": ["schema_version", "construction_scope", "claim_scope", "proposal_id", "source_component_id", "disposition", "resulting_claim_ids", "rationale"],
      "id_column": "proposal_id",
      "scope_column": "construction_scope"
    },
    "claims": {
      "path": "artifacts/claims/claims.jsonl",
      "kind": "bottom_up_claim_ledger",
      "format": "jsonl",
      "media_type": "application/x-ndjson",
      "sha256": "9b6a6be7be195815259918d77fa0eb2361f0bf8806490f4e68cd7388862270bd",
      "bytes": 555034,
      "records": 555,
      "schema": "schemas/claim.schema.json",
      "required_fields": ["schema_version", "claim_scope", "claim_id", "statement", "scope", "higher_order_basis", "confidence", "source_proposal_ids", "target_genes", "contribution_count"],
      "id_column": "claim_id",
      "scope_column": "claim_scope"
    },
    "claim_contributions": {
      "path": "artifacts/claims/contributions.jsonl",
      "kind": "finding_claim_contribution_ledger",
      "format": "jsonl",
      "media_type": "application/x-ndjson",
      "sha256": "ea162fd9898c3c48913a990c6f8214a79e0b52da50c50ab27cad551a37abe040",
      "bytes": 955894,
      "records": 2234,
      "schema": "schemas/claim-contribution.schema.json",
      "required_fields": ["schema_version", "contribution_id", "claim_id", "claim_scope", "finding_doc_id", "target_gene", "finding_id", "role", "rationale"],
      "id_column": "contribution_id",
      "scope_column": "claim_scope"
    },
    "finding_claim_dispositions": {
      "path": "artifacts/claims/finding_dispositions.jsonl",
      "kind": "finding_claim_layer_dispositions",
      "format": "jsonl",
      "media_type": "application/x-ndjson",
      "sha256": "1f5986e4a99234cec5594248a4c455f506d0930e0180109772d2ff763ddb1756",
      "bytes": 2195008,
      "records": 8718,
      "schema": "schemas/finding-claim-disposition.schema.json",
      "required_fields": ["schema_version", "finding_doc_id", "target_gene", "finding_id", "disposition", "claim_ids", "contribution_roles", "neighborhood_count"],
      "id_column": "finding_id",
      "scope_column": "target_gene"
    },
    "claim_build": {
      "path": "artifacts/claims/build.json",
      "kind": "bottom_up_claim_build_record",
      "format": "json",
      "media_type": "application/json",
      "sha256": "cd100db2a13c652aeef84c5d9bfa6a6639fcb7ef8a8e28e63dbd130af4b26b66",
      "bytes": 3954,
      "records": 1,
      "schema": "schemas/claim-build.schema.json",
      "required_fields": ["schema_version", "versions", "source", "inputs", "outputs", "counts", "model_provenance", "build_policy"]